{
 "$schema": "schema/spec.schema.json",
 "note": "Generated by `evegen index`; do not edit. sections: [depth, anchor, line, title].",
 "pages": [
  {"path": "conformance/README.md", "title": "Conformance", "status": "draft", "summary": "The features of each level are in features/ (one file per level). A test declares the features it checks in its tracking file (features, a list of feature ids), so the coverage of a feature is read fr", "lines": 68, "bytes": 4476, "features": [], "sections": [
    [2, "levels", 5, "Levels"],
    [2, "test-files", 19, "Test files"],
    [2, "expectations-expect---blocks", 27, "Expectations: `/*@expect … */` blocks"],
    [2, "verdicts", 59, "Verdicts"],
    [2, "the-tracking-file", 63, "The tracking file"]
   ]},
  {"path": "index.md", "title": "Eve Specification", "status": "draft", "summary": "The specification is written level by level. The features of each level, with their status, are in [features/](features/level1.json) (level1.json to level7.json, all.json); each feature has a short Ma", "lines": 52, "bytes": 5515, "features": [], "sections": [
    [2, "reading-order", 5, "Reading order"],
    [2, "sources-of-the-rules", 34, "Sources of the rules"],
    [2, "change-log", 38, "Change log"]
   ]},
  {"path": "lexical/lexical.md", "title": "Lexical Structure", "status": "draft", "summary": "Words in this document: must and must not mark a requirement for every implementation; may marks a free choice. A rule marked (proposed) is not yet decided by the author; it is listed in [Open points]", "lines": 268, "bytes": 20151, "features": [], "sections": [
    [2, "source-text", 7, "Source text"],
    [2, "tokens", 17, "Tokens"],
    [2, "file-header", 38, "File header"],
    [2, "comments", 50, "Comments"],
    [2, "identifiers", 87, "Identifiers"],
    [3, "prefixes-sigils-and-suffix", 106, "Prefixes, sigils and suffix"],
    [2, "keywords", 117, "Keywords"],
    [2, "literals", 121, "Literals"],
    [3, "integer-and-natural", 123, "Integer and Natural"],
    [3, "real", 136, "Real"],
    [3, "imaginary", 146, "Imaginary"],
    [3, "rational", 150, "Rational"],
    [3, "rune", 154, "Rune"],
    [3, "string", 163, "String"],
    [3, "constants", 210, "Constants"],
    [3, "collection-delimiters", 214, "Collection delimiters"],
    [2, "operators-and-punctuation", 226, "Operators and punctuation"],
    [2, "layout", 247, "Layout"],
    [2, "lexical-errors", 256, "Lexical errors"],
    [2, "open-points", 260, "Open points"]
   ]},
  {"path": "library/atomic.md", "title": "Atomic", "status": "draft", "summary": "Atomic(:T) is a class of the standard library. It wraps the atomic of the machine (the virtual machine is written in Zig, and the class is a wrapper of the Zig atomic): each operation on the value is ", "lines": 40, "bytes": 2219, "features": ["F-SPEC-04"], "sections": [
    [2, "what-it-is", 5, "What it is"],
    [2, "declaring", 18, "Declaring"],
    [2, "using", 31, "Using"],
    [2, "open-points", 35, "Open points"]
   ]},
  {"path": "library/builtins.md", "title": "Built-in names", "status": "draft", "summary": "These names need no import and no library file: the virtual machine provides them. A later version may write some of them in a library module that the machine loads on its own; the names and the rules", "lines": 24, "bytes": 1693, "features": ["F-LIB-01", "F-LIB-02"], "sections": [
    [2, "output-input-and-logs", 7, "Output, input and logs"],
    [2, "errors", 21, "Errors"]
   ]},
  {"path": "library/bytes.md", "title": "Bytes and Uuid", "status": "Bytes built", "summary": "Bytes is an immutable sequence of bytes. It is not text: it is not checked as UTF-8, it has no rune and no case. It is what a file read in binary, the body of an HTTP response, a hash, a key and a BLO", "lines": 62, "bytes": 5198, "features": [], "sections": [
    [2, "bytes", 5, "Bytes"],
    [2, "uuid", 34, "Uuid"]
   ]},
  {"path": "library/config.md", "title": "The module `config`", "status": "draft", "summary": "Reads the key = value files of the machine (eve.cfg, evedb.cfg, eve.env; format in [machine.md](machine.md#configuration)) into a DataMap.", "lines": 28, "bytes": 1352, "features": [], "sections": [
    [2, "format", 13, "Format"],
    [2, "members", 20, "Members"]
   ]},
  {"path": "library/crypto.md", "title": "The module `crypto`", "status": "draft", "summary": "Hashes, a keyed hash, random bytes and the text codecs. A String is a sequence of bytes (UTF-8 text); a function that works on bytes takes and gives a String, and a digest is given as lower-case hexad", "lines": 29, "bytes": 2034, "features": ["F-LIB-10"], "sections": [
    [2, "errors", 22, "Errors"]
   ]},
  {"path": "library/data-engines.md", "title": "Data engines and legacy files", "status": "first draft (2026-10-17)", "summary": "Where each one lives. SQLite is compiled into every eve (the light edition, usually a client) and holds its own state and the functions written in Eve. DuckDB lives in evedb, the enterprise edition: t", "lines": 137, "bytes": 10886, "features": [], "sections": [
    [2, "two-engines", 5, "Two engines"],
    [2, "the-query-engine-sqlite-memory", 16, "The query engine: SQLite `:memory:`"],
    [2, "the-memory-class", 30, "The `Memory` class"],
    [2, "the-columnar-table", 77, "The columnar table"],
    [2, "moving-data-between-the-engines", 96, "Moving data between the engines"],
    [2, "files-legacy-ingestion", 107, "Files: legacy ingestion"],
    [2, "open-points", 134, "Open points"]
   ]},
  {"path": "library/data-language.md", "title": "Data language", "status": "draft", "summary": "A generator is declared with the keyword generator: generator count_to(n: Integer) => (@x: Integer) is … yield x; … return;. It replaces the detection of yield in a method. A generator is a task that ", "lines": 136, "bytes": 11993, "features": ["F-LIB-08", "F-LNG-14"], "sections": [
    [2, "features-and-versions", 5, "Features and versions"],
    [2, "generators", 23, "Generators"],
    [2, "time-types", 27, "Time types"],
    [2, "decimal-and-optional-types", 38, "Decimal and optional types"],
    [2, "bytes", 42, "Bytes"],
    [2, "files-and-paths", 46, "Files and paths"],
    [2, "http-client", 61, "HTTP client"],
    [2, "secrets", 74, "Secrets"],
    [2, "shell-by-argument-list", 78, "Shell by argument list"],
    [2, "details-used-by-the-tests", 82, "Details used by the tests"],
    [2, "compression", 89, "Compression"],
    [2, "system-library-modules", 97, "System library modules"],
    [2, "open-points", 116, "Open points"],
    [2, "json-text-in-memory-jsonparse-and-jsontext", 122, "JSON text in memory: `json.parse` and `json.text`"]
   ]},
  {"path": "library/database.md", "title": "Database layer", "status": "draft", "summary": "A program reaches a database by a connection name. The name is declared in eve.cfg with a URL; the script never sees the URL, the driver or the password. The same code runs on every path:", "lines": 405, "bytes": 40826, "features": ["F-DAT-01", "F-DAT-04", "F-DAT-09", "F-DAT-13", "F-DAT-14"], "sections": [
    [2, "layers", 5, "Layers"],
    [2, "configuration-evecfg", 29, "Configuration: `eve.cfg`"],
    [2, "records", 59, "Records"],
    [2, "the-table-declaration", 71, "The `table` declaration"],
    [2, "column--value-mapping", 120, "Column = value mapping"],
    [2, "mapping-validation", 146, "Mapping validation"],
    [2, "sessions-and-tracked-records", 169, "Sessions and tracked records"],
    [3, "states-of-a-record", 173, "States of a record"],
    [3, "dirty-fields", 186, "Dirty fields"],
    [3, "the-update-block", 195, "The `update` block"],
    [3, "methods-of-a-table", 209, "Methods of a table"],
    [2, "sql-that-writes-only-what-changed", 231, "SQL that writes only what changed"],
    [3, "validation", 247, "Validation"],
    [2, "transactions", 251, "Transactions"],
    [2, "direct-sql", 296, "Direct SQL"],
    [2, "stored-procedures", 311, "Stored procedures"],
    [2, "sql-functions", 351, "SQL functions"],
    [2, "errors", 372, "Errors"],
    [2, "drivers-and-the-server", 388, "Drivers and the server"],
    [2, "admin-commands", 398, "Admin commands"],
    [2, "open-points", 402, "Open points"]
   ]},
  {"path": "library/http.md", "title": "The module `http`", "status": "draft", "summary": "HTTP/1.1 as text on a Socket: read a request, write a response, call a server. One request for each connection (Connection: close); no keep-alive, no chunked bodies, no TLS (https:// is level 9), no p", "lines": 27, "bytes": 1959, "features": [], "sections": [
    [2, "classes", 7, "Classes"],
    [2, "functions", 16, "Functions"]
   ]},
  {"path": "library/lists.md", "title": "List functions", "status": "draft", "summary": "The functions of a List ( ), an Array [ ] and, where it makes sense, a DataSet { }. A function is called on a value, xs.sort(). A function never changes the list it is called on: it gives a new value,", "lines": 38, "bytes": 3117, "features": [], "sections": [
    [2, "functions", 9, "Functions"]
   ]},
  {"path": "library/machine.md", "title": "The Eve machine: parts, doors, local and remote", "status": "draft", "summary": "eve is one program, with one version. Its first word chooses a part:", "lines": 221, "bytes": 27836, "features": ["F-NET-02", "F-NET-08"], "sections": [
    [2, "the-parts-of-eve", 5, "The parts of `eve`"],
    [2, "the-machine", 20, "The machine"],
    [2, "the-serving-machine-level-6", 32, "The serving machine (level 6)"],
    [2, "configuration", 48, "Configuration"],
    [2, "the-options", 64, "The options"],
    [2, "service-mode-level-6", 112, "Service mode (level 6)"],
    [2, "channels", 126, "Channels"],
    [2, "lasting-doors-level-6", 139, "Lasting doors (level 6)"],
    [2, "the-machine-api-level-6", 160, "The machine API (level 6)"],
    [2, "remote-access-a-reverse-proxy", 181, "Remote access: a reverse proxy"],